{
  "required" : true ,
  "$schema" : "http://json-schema.org/draft-03/schema" ,
  "type" : "object" ,
  "properties" : {
    "self" : {
      "type" : "string" ,
      "required" : false
    } ,
    "name" : {
      "type" : "string" ,
      "required" : false
    } ,
    "id" : {
      "type" : "number" ,
      "required" : false
    } ,
    "description" : {
      "type" : "string" ,
      "required" : false
    } ,
    "actors" : {
      "type" : "array" ,
      "required" : false ,
      "items" : [
        {
          "type" : "object" ,
          "properties" : {
            "id" : {
              "type" : "number" ,
              "required" : false
            } ,
            "displayName" : {
              "type" : "string" ,
              "required" : false
            } ,
            "type" : {
              "type" : "string" ,
              "required" : false
            } ,
            "name" : {
              "type" : "string" ,
              "required" : false
            }
          }
        }
      ]
    }
  }
}