{
  "self" : "http://www.example.com/jira/rest/api/2/project/MKY/role/10360" ,
  "name" : "Developers" ,
  "id" : 10360 ,
  "description" : "A project role that represents developers in a project" ,
  "actors" : [
    {
      "id" : 10240 ,
      "displayName" : "jira-developers" ,
      "type" : "atlassian-group-role-actor" ,
      "name" : "jira-developers"
    }
  ]
}